{
  "schemaVersion": 2,
  "id": "authored-local-review-scene",
  "revision": "authored-initial-revision",
  "sceneFrameId": "local-study",
  "frames": [
    {"id": "local-study", "body": null, "kind": "cartesian", "definition": {"encoding": "opaque", "value": {"purpose": "Authored local axes, no physical calibration"}}, "cartesian": {"axisConvention": "x-right,y-forward,z-up", "metresPerUnit": null}},
    {"id": "original-model", "body": null, "kind": "unknown", "definition": {"encoding": "opaque", "value": {}}, "cartesian": null}
  ],
  "assets": [
    {"id": "unresolved-model", "contentHash": null, "format": null, "locators": [], "metadata": {}, "evidence": {"origins": [], "lineage": [], "statements": []}}
  ],
  "operations": [
    {"id": "declared-placement", "kind": "affine", "version": 1, "sourceFrameId": "original-model", "targetFrameId": "local-study", "payload": {"linear": [1,0,0,0,1,0,0,0,1], "translation": [0,0,0]}, "evidence": {"origins": [], "lineage": [], "statements": [{"category": "declaration", "status": "supplied", "details": {"basis": "Authored identity relation for schema review only; physical units remain unknown"}}]}}
  ],
  "registrations": [
    {"id": "declared-solution", "operationId": "declared-placement", "supersedes": null, "evidence": {"origins": [], "lineage": [], "statements": []}}
  ],
  "layers": [
    {"id": "model-layer", "name": "Unresolved model example", "sourceFrameId": "original-model", "activeRegistrationId": "declared-solution", "sourceAssetIds": ["unresolved-model"], "representations": [{"id": "model-representation", "assetId": "unresolved-model", "frameId": "original-model", "toSourceOperationId": null}], "metadata": {}, "evidence": {"origins": [], "lineage": [], "statements": []}}
  ],
  "metadata": {"purpose": "Synthetic schema example; no observed dataset or accuracy claim"},
  "extensions": {}
}
